,id,text
0,dp8z33y,"If you're attracted to someone, date them, sleep with them, and are happy with all those choices, and then you find out they're dyslexic and suddenly you're not interested, I would absolutely call you ableist."
1,t3_30uf3s,"""I used to own a galaxy s2, and currently own a galaxy s4.  My upgrade is almost up, but I see no reason to go with an s6.  

-The difference in performance was noticeable, but on a cost/performance basis it was negligible.  

-I do not see the purpose in the increasingly large resolutions coming to the market.  1440 x 2560, the s6 resolution, is simply unnecessary.  ***EDIT: it seems I was wrong here***

-The upgraded camera features, sensors, etc. are nice, but the number of megapixels has reached its peak, and anyone else who truly cares about the rest will use the $500+ or whatever to actually get themselves a real camera.  

-Many of the nifty little features added to newer versions of cell phones can already be added to old phones, given that the user is even slightly capable of leveraging the app store and/or android community.  I would assume the same can be said of Apple products, but am not as familiar with them.  

I can see significant technological progress being noticeable in the long run, but for now, unless you are coming from a smartphone that is 5+ years old, upgrading to the newest smartphones on the market is a waste of money. Battery life and durability should be the focus of demand from consumers.  Yet, in regards to the s6, battery life is regressing (non-removable, thus cant be replaced as it degrades over time), waterproofing was removed, and even storage is now becoming non-removable.  

I should add a caveat to my CMV: I am not interested in playing the latest games on my phone.

_____

&gt; *Hello, users of CMV! This is a footnote from your moderators. We'd just like to remind you of a couple of things. Firstly, please remember to* ***[read through our rules](http://www.reddit.com/r/changemyview/wiki/rules)***. *If you see a comment that has broken one, it is more effective to report it than downvote it. Speaking of which,* ***[downvotes don't change views](http://www.reddit.com/r/changemyview/wiki/guidelines#wiki_upvoting.2Fdownvoting)****! If you are thinking about submitting a CMV yourself, please have a look through our* ***[popular topics wiki](http://www.reddit.com/r/changemyview/wiki/populartopics)*** *first. Any questions or concerns? Feel free to* ***[message us](http://www.reddit.com/message/compose?to=/r/changemyview)***. *Happy CMVing!*"""
2,t1_cpvxc6j_1,"&gt; Battery life and durability should be the focus of demand from consumers.
Gee, somebody should've told that to Steve Jobs when he came up with the iPhone. ""Hey Steve, your idea is shit because this phone is non-durable and its battery life sucks!"" The world wouldn't be saddled with this flimsy phone and its non-removeable battery, which you can only fix if you take it to a specialty retailer, and Apple wouldn't be a multi-billion dollar company."
3,cys9xnl,"As a engineering major,  I personally probably couldn't even stomach the work for a art history degree.  Those papers stress me out. however I love math and problem solving, hacking through a big problem excites me in a way that I'm sure others are excited by historical research and writing. "
4,cysac2e_2,"Also, bear in mind that many art papers are difficult to read because the authors use excessive jargon and other obfuscating techniques to hide the fact that they actually have a fairly simple point to make. I'll take the heat for this claim, but I'm not the first person to make it, and it's pretty obviously true unless you just don't want it to be."
5,cysj01x,"[Here's](http://i.imgur.com/bBTjZPw.png) a screenshot of the first page of the first article that appeared when I searched JStor for ""art history""."
6,d164d22,"Pro-abortion implies being, well, *for* abortion. The vast majority of pro-choice people are not pro-abortion and would prefer it happen as little as absolutely possible, but there is a strong belief that the *choice* to have one should remain with the woman, not the government. They are, in fact, pro-choice and not pro-abortion. They don't *want* people to have abortions, they want people to have the right to make the *choice*."
7,d16at8t,"Although you're arguing it's a right, therefore this surely transcends law?"
8,d4hcjto,"Meh, not trying to support the actions of the rioters, but I don't think they were trying to coerce anyone politically so much as trying to exact some form of retribution for perceived slights."
9,d4hcl84,"&gt; I don't think they were trying to coerce anyone politically

You don't think intimidation of Trump supporters was a motive in any cases?"
10,d4hcon6_2,"&gt;They were just being assholes.
Well, acts of terrorism are one way to be an asshole. So in any event, I don't disagree."
11,dzgz6m2_1,"I’m on my phone so I’m sorry this answer is short in comparison to your OP. But there are a few things to consider.
1. Global warming will put stress on our institutions. While 1st world countries have enough resources to adapt, other countries might not. For example, the prolong drought in the Middle East influenced the current political uprising."
12,dzgz6m2_2,"2. We are currently experiencing massive extinction period. Global warming is one of the many reasons too.
3. Personally, I see global warming denying a sign that we have an education problem. This is in line with anti vaccination and flat earth conspiracy theory. I know that your question is about the impact of global warming itself, however, I think the ignorance increases the need to talk about it."
13,dzh0xpe,"Oh my, the 3rd point is not directed towards you. I can see from the other comments (and rereading my own) why you think it was. But let me clarify. The need to address global warm increases because of science deniers. 

(You seem like a reasonable guy, btw.) "
14,e6ciwm3_1,"&gt; I have a feeling that no corroborating or falsifying evidence is going to present itself with regard to the Ford/Kavanaugh situation.
Potential corroborating evidence:"
15,e6ciwm3_2,"* The WaPost has seen therapist records from 2012 in which Ford discussed this assault.  This strongly demonsrates this story was not concocted to undermine Kavanaugh's SCOTUS nomination.
* Her husband was told in 2012 (this evidence is less useful, because he is a biased witness).
* One other woman at her school said the assault was talked about at the time.  Given time to investigate, more students at the school could be found.  This, again, shows that it pre-dates the time when K became important."
16,e6ciwm3_3,"* K's friend Mark Judge has a history of innuendo, inebriation, and, well, skeeviness.
* Any connected and demonstrated un-truths K says about not knowing the victim, his other activities at the time, etc. impugn his reliability as a witness, as well as constitute potential perjury.
You won't build a 'beyond reasonable doubt' case like in a criminal trial, but if you try you certainly have a good shot at a ""strong weight of the evidence"" case, stronger than a civil case.   And becoming a SCOTUS justice is not a right; it is a privilege extended only to the very best and most ethical."
17,e6clcvs_1,"&gt; I just have a bad feeling nothing really solid will be revealed.
Therapist notes from 2012 are reasonably solid.  Not ""beyond a reasonable doubt"" but ""strong preponderance of evidence.""       They show that this is not a politically driven claim."
18,e6clcvs_4,"Suppose that 1) K is consistent and repeats his claim of innocence under oath (otherwise, he's ineligible for the court); 2) You believe 90% that something happened to F; 3) you think there is a  (implausibly high) 40% chance of mistaken identity, despite them apparently moving in the same social circle.  Then, as a spectator, you'd conclude that there is a 54% chance that K committed a felony of perjury.    You would never vote for a person who has a 54% chance of being a felon to the SCOTUS."
19,e6clcvs_5,"Now you might ask .... how could K (or anyone) ever have a chance against random accusations?  Well, an accusation from a woman who never knew him or never moved in his social circle would be ignored.  An accusation with no past corroborating evidence (therapist notes, witnesses) would have much less value.    An accusation by a person with a history of false accusations or mental illness would be downplayed.  Heck,  George Bush was accused of raping some nutty woman, but it was obvious that she and he had never come into proximity, so it was laughed off except by conspiracy sites."
20,e6d3cso_2,"Lightbulb!
She recalls that she discussed in relatively vague detail an assault that she was subjected to at a young age with a therapist, and that she didn’t specify any names. Given their close proximity to one another during school, the fact that he fits the profile for the perpetrators (as do doubtless hundreds of kids who went there, to be fair), and the lack of names given, it’s totally possible to put Kavanaugh’s name onto one of these nameless, faceless criminals and potentially stop his confirmation."
21,e6d3cso_5,"“Sure, we can’t *show* s/he’s not ethically immaculate, but we’ve brought doubt on it and you can’t demonstrate s/he is!”"
22,e6d69zl_1,"&gt; But I’ve talked with lawyers before for mock trial in high school,
OK, Perry Mason. I see we're dealing with an expert."
23,e6d69zl_2,"&gt;  and another important legal guideline is that out-of-court testimony cannot be used to establish the fact of the matter asserted;
This *ISN'T A COURT CASE*, Mr. Lionel Hutz.  Put your pelican back in your briefs."
24,e6d6hj8_1,"&gt;I see we’re dealing with an expert
Finally someone recognizes and appreciates my unparalleled legal expertise."
25,dbrj3ub_2,"&gt; most anti-feminists have no idea of the realities of being a woman
That's true; men don't know what is like to work a dead end job for 30 years before waking up one morning and feeding your cat at which point you realize you utterly wasted your life. Men don't know what it is like to feel so emotionally broken that the only way you conjure life temporarily back to your permanently dead body is to be defiled by peoples who names escape you. Men don't know what it is like to have such a void in heart emotionally that the only thing of fucking meaning you can do in your life is go protest to let Muhammad into your country so maybe, just maybe, one of them is hot and rapes you in a back ally somewhere. Men don't know what it is like to be so confused by the culture that they think being objectified sexually is wrong, but getting gangbang Dp'd by 5 black dudes is ""liberating""."
26,dbrlkqg,"Dude, you sound depressed.  I think you might want to look into some professional help.  I really wish you peace and happiness.  "
27,dbrmdcs,"I am anti-feminist, but also anti-egalitarian in general. I'm a reactionary and have realized that every morality developed after the French revolution is complete rubbish. To bring society back to health, we must undue the institutions that made it sick in the first place. Racial and sexual egalitarianism being the core of these sicknesses. "
28,dbrmue8_1,"I mostly agree but I'm more like a Taoist who believes in eternal ideas that bring the most harmony so ""reactionary"" isn't a label I think suits me even if thats what the Marxists will call me.
One of those eternal ideas is that men and women are different, not just slightly different but yin/yang different. The best thing to do is let their differences flourish and that brings harmony."
29,dbrmue8_2,"As of now the feminist project is trying to reduce differences by simply turning women into men. Its penis envy gone crazy.
I believe we should restore masculinity and femininity"
30,d5q07u2,"Have you ever seen or read Moneyball? Its a book/movie that describes how a coach who had a third the budget of the best paid teams in American Baseball was still able to beat them. It was about how all the players who are perceived as best by fans and scouts aren't really as good as people think they are. I am not really that familiar with European football, but I think this story proves that there can still be a lot of competitiveness in professionals sports even if leagues have teams with lopsided budgets. "
31,d5q0fkh,"Poorer teams can have great players like Southampton with Le Tissier, etc, but City were never a good team before their takeover. Never challenged for trophies."
32,d5q0wdg,"Yeah, in like the 1950s. They've always been mediocre afterwards. Villa won the Champions League in the 80s. Are they still a CL team?"
33,d5q3eh6,"Yes, because of recent times. Please link me your source for that number please."
34,d85zj9e_1,"&gt;The rape of men is considered to be humorous, while the rape of women is not (EG - the rape scene in Wedding Crashers, ""don't drop the soap"").
Agreed entirely, and feminists don't disagree that this is a problem, it's in fact part of ""rape culture"", which you hear so much about from feminists, that rape is viewed as a punitive measure, something that people are all too happy occurs in our prison system (to both men and women) and is even found funny. Feminists aren't happy with rape being trivialized in *any* context."
35,d860jzy_2,"Thus, when I see a feminist discussing gender roles and how the impact women, I conclude that they are only concerned with women being in gender roles. It'd be one thing if the argument began with ""we're going to focus on gender roles that impact woman"" or something similar, but in my experience this isn't common."
36,d860jzy_4,"So, is my reasoning incorrect? Or, is my reasoning mostly correct but I'm wrong about this being uncommon in the feminist community? The majority of my views on feminism are from NOW.Org, so if there is a more official spokesgroup for feminism then I'd be interested in seeing that as well."
37,t3_2qr8gn,"""There seems to be a commonly held belief that people who cheat on their SO/partner should be dropped immediately with no further contact. I understand that physical/sexual conduct with another person can seem like a betrayal, but in some cases, there are many worse things that can happen in a relationship, which couples seem to be able to work through.

There are a few assumptions underlying the belief that ""sex with another person = relationship over"" that I don't think hold up.

 * **Sex is the most important part of a relationship,** and therefore, betraying it and that agreement mean the relationship should end. My belief: sex is a very important part of a relationship, but not *the* most important part. Immediately breaking up with someone because of something like this seems excessive.

 * **Nobody makes mistakes ever,** so when they do, the relationship should end. My belief: obviously this isn't true, and a cornerstone of strong relationships is the ability to work through mistakes/issues together.

 * **Cheaters will always cheat again,** so better to end it now. my view: That may be true in some cases, but other than anecdotal evidence, I haven't seen anything to support this claim. [But would be really interested in reading anything scientific about this, actually!]

 * **Cheaters cheat because of underlying issues with the relationship.** My belief: if that's true, there are a lot of possibilities - not just breaking up - that could fix the problem, such as ... talking about the problem. Maybe fixing that issue will resolve the motivation to cheat.

Caveat: sometimes, cheating happens because there are parts of the relationship that are fundamentally broken and/or the relationship is too far gone/unsalvageable and/or this is the straw the broke the camel's back etc. 

Cheating shouldn't always signify an immediate end to a relationship. In some cases, couples can and should choose to work through it. CMV!
_____

&gt; *Hello, users of CMV! This is a footnote from your moderators. We'd just like to remind you of a couple of things. Firstly, please remember to* ***[read through our rules](http://www.reddit.com/r/changemyview/wiki/rules)***. *If you see a comment that has broken one, it is more effective to report it than downvote it. Speaking of which,* ***[downvotes don't change views](http://www.reddit.com/r/changemyview/wiki/guidelines#wiki_upvoting.2Fdownvoting)****! If you are thinking about submitting a CMV yourself, please have a look through our* ***[popular topics wiki](http://www.reddit.com/r/changemyview/wiki/populartopics)*** *first. Any questions or concerns? Feel free to* ***[message us](http://www.reddit.com/message/compose?to=/r/changemyview)***. *Happy CMVing!*"""
38,t1_cn9b5po_1,"I'l begin by saying it has never happened to me, and you make some good points. But I'm addicted to CMV, so here we go.
&gt;sex is a very important part of a relationship, but not the most important part.
So it is one of the most important parts. To break it would be to break one of the most important parts of a marriage. I'll continue."
39,t3_24c5qv,"""I know this is a frequent topic, but I really want to have my View changed. The Second Amendment was created with the intent to create a *well regulated* militia to defend from invasion and tyranny. The United States has come a long ways from the 1700's, and no nation could ever invade in this day and age due to the nuclear threat we pose and our massive army. I understand people keeping pistols for self defense, but why would any one need something like an AR-15, which is basically the same gun that the United States Military uses. why would anyone need a weapon like that in our day and age with advanced police forces and military. its not like you are going to be attacked by roving hoards of bandits. A stated reason for the Second Amendment is to resist tyranny, but I don't think that is possible in this day and age, as the modern US military would crush any resistance, as they have the best tanks in the world (try shooting an Abrams) and the best air force. not to mention that few would seriously take up arms in America, as we have it far too good. in the end, i do not believe there is a valid reason for the second amendment, as weapons such as assault rifles are pretty much unnecessary and even a liability, as they have been used for horrible tragedies, such as Sandy Hook and Aurora 

_____

&gt; *Hello, users of CMV! This is a footnote from your moderators. We'd just like to remind you of a couple of things. Firstly, please remember to* ***[read through our rules](http://www.reddit.com/r/changemyview/wiki/rules)***. *If you see a comment that has broken one, it is more effective to report it than downvote it. Speaking of which,* ***[downvotes don't change views](http://www.reddit.com/r/changemyview/wiki/guidelines#wiki_upvoting.2Fdownvoting)****! If you are thinking about submitting a CMV yourself, please have a look through our* ***[popular topics wiki](http://www.reddit.com/r/changemyview/wiki/populartopics)*** *first. Any questions or concerns? Feel free to* ***[message us](http://www.reddit.com/message/compose?to=/r/changemyview)***. *Happy CMVing!*"""
40,t1_ceo0vsq,"Being able to speak multiple languages can help you think in different ways in addition to speaking a language differently. I dont know how useful the 12 language people will be, but learning multiple languages will still be useful just for the cognitively inspirational aspect. Apart from that, in 20 years we may have excellent babelfish-like translation tools that are cheap and effective, or we may not. If not, then maybe in 30 years or something. "
41,t1_ceo1051,"I absolutely agree with learning more than one language, I speak english and am competent at two others myself but learning more than say 5/6 is, imo, just an attempt at showing off"
42,t1_ceh07bk_1,"&gt;I think that it is Ok to pee in the shower because in theory it saves water. why use the toilet, flush, and then hop in the shower, when you could have so easily used the drain with running water right in front of you?
Depending on where you live, this logic could work (they encourage you to do this in hotels in Brazil and Argentina) The problem is that in most first world personal contexts this is not acceptable."
43,ddyir7p,"Anyone poor and on food stamps should lose the ability to pick and chose their foods, but if you are rich you get to decide for yourself?


Seems like a way to force a way of life onto the poor. "
44,e3h2ijs,"I have found that anyone who refuses to engage a person in civil discussion based on the subreddits in which they have posted, is the kind of person who cannot be reasoned with, so they are saving you the bother of trying to have a reasonable discussion with them."
45,e3hqwq6,Maybe we should make an auto-labeler for those kind of people so you can shortcut attempting to engage in civil discourse with them. 🤔
46,dy2z5gl_1,"&gt; I don't think there are currently any prohibitions against doing this
I was thinking the same. If you had a test case of this (that is, a case in which someone actually got sick due to a specific unvaccinated person), you could conceivably make out the elements of a negligence claim:"
47,dy2z5gl_2,"1) Duty: People generally have a legal duty to exercise ""reasonable care"" to avoid injury to others. This element hinges on whether the harm caused is ""foreseeable,"" but in most circumstances, you have a duty of reasonable care to those in physical proximity to you.
Is failing to vaccinate a failure to exercise such care? I don't believe there's any precedent for that, but it's possible a court would buy that. In any case, this would be the first major legal hurdle."
48,dy2z5gl_3,"2) Breach: If there is indeed a duty, then the defendant breached that duty by not vaccinating. Easy enough.
3) Damages: Plaintiff got sick. Easy enough, this is why you are suing in the first place.
4) Causation: There are two elements to this. Was defendant's action a substantial factor in bringing about the harm (sickness)?  And was that harm (sickness) a reasonably foreseeable consequence of the defendant's failure to vaccinate?"
49,dy2z5gl_4,"The first question is a tough one. How can you prove you got sick from a specific person? Barring some sort of notable physical contact or assault, it would seem a pretty tenuous case. Heck, every time I get sick I play the game ""OK, who got me sick?"" but it's pretty much a guess."
50,d0bz6bp_2,"Talking about prey. The hunting of animals is another benchmark for humans (well ancient animal like ancestors of humans). Once we started eating meat, we had to start hunt for food. That means we had to adapt to run fast, be strong and most importantly be clever.
Some herbivores are by leagues faster than carnivores. Which offcourse means we needed to use our brains to kill them. Starting to form packs, cornering the animals, using tools to hunt for the animals, etc... None of our society would be possible if we didn't hunt animals."
51,d0bz6bp_7,"But, and this is a big but. Eating meat is still the most optimal way to get yourself into the best health you can possibly have. Which is the single most important thing you have."
52,d0coanv_1,"You said:
&gt; Because our body doesn't know how to function properly without meat.
You also said:"
53,dhw5rij,"It hasn't worked in real life.. but with distribution of resources handled by advanced algorithms run through computers rather than corruptible or incompetent bureaucrats, couldn't it?"
54,e2f0a1k,"It’s a lot more appropriate, and easier, to put another layer of clothes on in a professional setting than it is to strip clothes off. 

Although I’d love to go shirtless and work"
55,e2f0n4s,"Uhhh... isn't that exactly what people should be telling the women who are complaining about this? 

Men are already wearing usually 2 shirts and a jacket when they are in office buildings of the sort they are talking about..."
56,e2f17lj,"I dunno. I work in a fairly corporate space and don’t wear a jacket unless we have a meeting with someone we haven’t dealt with before. No undershirt, it’s socal it’s too hot for that shit."
57,t3_2pkvb6,"Now, I do not consider myself to be an unhappy person. Things are actually pretty good for me. I come from a pretty good background with parents who care about me and relatives who love me. I have many opportunities. 

That being said, I think never have being born would have been much better. 

1)  The joy I feel doesn't outweigh the anxiety I have towards death. Since we are beings-toward-death, we leave in anticipation of it. It's inescapable. 

2) Not being born means not feeling anything, and not feeling anything means not feeling pain, and pain is a stronger emotion than happiness. 

3) As Sartre puts it, ""We are condemned to be free."" I'd rather not be condemned in the first place. Freedom is the product of condemnation to be subject to existence. Freedom means nothing if you don't want it. 

Please, CMV."
58,t1_cdgib3s_1,"A married dude here, 10+ years.
Make no mistake about it, marriage is tough.  Sometimes it's hair-tearingly frustrating.  But once you find your groove and learn how to maintain it, it's an awesome arrangement.
If both of you are roughly on the same page in terms of life priorities, you'll be accomplishing twice as much stuff.  Double the money, twice the chores, twice the fun.  You'll have a built-in audience for your frustrations and triumphs.  You'll hopefully develop deep trust and respect for each other and learn your collective strengths and weaknesses."
59,t1_cdhnr3m_2,"I think though that society should recognize that marriage is not right for everyone, particularly people who have a strong desire for freedom over comfort/security."
