,id,text
59,d86bzje_1,"&gt;It's not implied though, and this is fine. When people donate to these causes there is no expectation that the money is going towards curing all forms of cancer. Those and other groups are very clear on what their goal is, and don't misrepresent themselves.
You don't think it's clear enough that the National Organization for Women is an organization intended to address inequalities which affect women?"
60,d86cm12_1,"I think where we disagree is probably on our views of what equality means in this context. My view is that women already have social, political, and economic equality to men.
Firstly, there are no longer any laws in our country that are sexist.
Secondly, whether one is born female or male, that person will have arbitrary burdens and advantages placed upon them simply because of their gender. This happens to both genders, and thus both genders are equal. The inequity only occurs based upon the situation one finds themselves in."
61,d86cm12_3,"So to me, when a group is trying to eliminate one aspect of gender roles or double standards that happen to negatively impact just a single gender, they cannot be advocating for equality, rather they are advocating for advancement.
To just use objectification for example: If one is against that, then be against it. As soon as ""of women"" is added to the equation then it's an effort for advancement, not equality. The person is choosing to exclude the male gender from the argument against objectification."
62,d86dx8t_1,"&gt;I think where we disagree is probably on our views of what equality means in this context. My view is that women already have social, political, and economic equality to men.
This is demonstrably untrue in many ways. There's an enormous amount of evidence for things like pay disparity (even controlling for choice of work, hours, experience, etc), rates of sexual assault, reproductive rights, healthcare costs, and on and on. But even if it weren't:"
63,d86dx8t_2,"&gt;Firstly, there are no longer any laws in our country that are sexist.
So? Is violent crime no longer an issue because it's already illegal?"
64,d86dx8t_3,"&gt;Secondly, whether one is born female or male, that person will have arbitrary burdens and advantages placed upon them simply because of their gender. This happens to both genders, and thus both genders are equal. The inequity only occurs based upon the situation one finds themselves in.
This is a false equivalence. You can't just say that gender equality already exists because men and women both have problems. Gender equality isn't a state where both genders are equally subject to social bias, it's a state where neither gender is. The removal of any one destructive effect of gender roles/standards/biases is a step towards equality, it's not promoting inequality because it doesn't somehow annihilate a commensurate amount of bias towards the opposite sex. It's not a zero-sum proposition. Women being less screwed doesn't somehow reduce the stature of men in society."
65,d86dx8t_4,"&gt;If my dream is to be a cement worker, it's pretty great to be male. If my dream is to run a daycare center, it's going to suck to be male. If I happen to be getting sentenced for murder, I'd do just about anything to be female rather than male.
All of these things suck. They're all bad. If you eliminated any one of these biases it would create a more equal world regardless of whether or not any of the others were also solved."
66,d86dx8t_5,"&gt;To just use objectification for example: If one is against that, then be against it. As soon as ""of women"" is added to the equation then it's an effort for advancement, not equality. The person is choosing to exclude the male gender from the argument against objectification.
Why? Explain how that's different from: ""To use cancer as an example: If one is against that, then be against it. As soon as ""colon"" is added to the equation then it's an effort for advancement, not equality. The person is choosing to exclude all non-colon cancers from the effort to cure cancer."""
67,t1_cn9b5po_3,"&gt;Cheaters will always cheat again
You are correct that this is false. However, I would say that *cheaters are more likely to cheat again*. The circumstances that resulted in cheating the first time may repeat."
68,t1_cn9b5po_5,"So, so far we can say cheating
* is a bad choice which breaks one of the cornerstones of a relationship
* is an indication that such a thing will happen again
* is an indication that there is a problem with the relationship
Are there no situations in which the cheaters should be forgiven? I'm trying to argue that if you find your spouse cheating, breaking up with them is the most logical thing to do, whatever the circumstances."
69,t1_cn9b5po_7,"It is entirely up to the person making the decision as to what they may do. It's an ethical question, and everyone has their different values, so it's impossible to prove definitively what you should/should not do. It's just a logical conclusion that breaking up is the right choice in most if not all situations. It's a choice."
70,t1_cn9j8n8,"&amp;#8710; 

&gt; marriage is a commitment. If you break that commitment, the marriage is broken. 

This is the best argument I've heard so far. Thanks!"
71,t1_cj7geua_2,"Not so with ID.  If the universe was created by a being that was, by definition, transcendent of this universe, there's no set of data that could disprove the idea of ID.  Those who support it never have to change or abandon their idea because nothing can contradict it."
72,t1_ch5og13_1,"&amp;#8710;
You have changed my view, we still do have a need for militias, as situations like the LA Riots remove law and order and leaves civilians to fend for themselves. its not much different from the founders days in that respect I guess. And apparently assault rifles don't kill that many people, so I guess their usage in emergencies is in no way outweighed by the amount of suffering caused by them."
73,t1_ceo0vsq,"Being able to speak multiple languages can help you think in different ways in addition to speaking a language differently. I dont know how useful the 12 language people will be, but learning multiple languages will still be useful just for the cognitively inspirational aspect. Apart from that, in 20 years we may have excellent babelfish-like translation tools that are cheap and effective, or we may not. If not, then maybe in 30 years or something. "
74,t1_ceo1051,"I absolutely agree with learning more than one language, I speak english and am competent at two others myself but learning more than say 5/6 is, imo, just an attempt at showing off"
